{
  "schema_version": 1,
  "context_id": "CTX-TASK-1389",
  "task_id": "TASK-1389",
  "created_at": "2026-09-23T10:40:00Z",
  "resolver_version": "intent-context/1.0.0",
  "intent": {
    "summary": {
      "statement_id": "INT-001",
      "text": "Intent Context Package v1 の provenance と identity contract を定義する",
      "source_ids": ["SRC-001"]
    },
    "desired_outcomes": [
      {
        "outcome_id": "OUT-001",
        "text": "Plan が参照した意味的コンテキストを再現可能にする",
        "source_ids": ["SRC-001"]
      }
    ],
    "non_goals": [
      {
        "non_goal_id": "NG-001",
        "text": "Dynamic Context Engine v1 を置き換えない",
        "source_ids": ["SRC-001"]
      }
    ]
  },
  "sources": [
    {
      "source_id": "SRC-001",
      "kind": "pbi_input",
      "ref": "docs/working/TASK-1389/pbi-input.md",
      "revision_ref": "git:0123456789abcdef0123456789abcdef01234567",
      "content_digest": "sha256:aaaaaaaaaaaaaaaaaaaaaaaaaaaaaaaaaaaaaaaaaaaaaaaaaaaaaaaaaaaaaaaa",
      "authority": "authoritative",
      "authority_basis": {
        "kind": "artifact_contract",
        "ref": "schemas/pbi-input.schema.json"
      },
      "freshness": "current",
      "freshness_basis": {
        "kind": "bound_revision",
        "ref": "git:0123456789abcdef0123456789abcdef01234567"
      },
      "observed_at": "2026-09-23T10:39:00Z"
    }
  ],
  "constraints": [
    {
      "constraint_id": "CON-001",
      "category": "compatibility",
      "statement": "#199 Context Manifest を置き換えない",
      "source_ids": ["SRC-001"]
    }
  ],
  "acceptance_inputs": [
    {
      "input_id": "ACI-001",
      "statement": "semantic context identity と exact snapshot identity を分離する",
      "source_ids": ["SRC-001"]
    }
  ],
  "assumptions": [
    {
      "assumption_id": "ASM-001",
      "statement": "既存 canonical hash 契約を再利用可能である",
      "source_ids": [],
      "verification_needed": true
    }
  ],
  "unknowns": [],
  "conflicts": []
}
